{
  "sprintNumber": 2,
  "feature": "configure-vault",
  "overallVerdict": "PASS",
  "timestamp": "2026-05-02T03:00:00Z",
  "iteration": 1,
  "dimensions": [
    {
      "name": "spec_fidelity",
      "verdict": "PASS",
      "findings": [],
      "evidence": [
        {
          "type": "file",
          "location": "promptnotes/src/lib/domain/configure-vault/pipeline.ts",
          "description": "configureVault now matches REQ-014 flat signature configureVault(deps, input). Result<VaultDirectoryConfigured, VaultConfigError> exact, port set ConfigureVaultDeps with vaultId/statDir/settingsSave/clockNow/emit honored. Carry-forward 1c findings (FIND-001..009) resolutions all applied."
        },
        {
          "type": "file",
          "location": ".vcsdd/features/configure-vault/specs/behavioral-spec.md",
          "description": "REQ-001..REQ-014 fully realized; spec REQ-014 acceptance line and verification-architecture.md Test Harness Layout updated to match the implemented file split (validate-and-transition.ts, map-stat-dir-result.ts, map-settings-save-error.ts) — FIND-004 resolution."
        }
      ]
    },
    {
      "name": "edge_case_coverage",
      "verdict": "PASS",
      "findings": [],
      "evidence": [
        {
          "type": "file",
          "location": "promptnotes/src/lib/domain/__tests__/configure-vault/pipeline.test.ts",
          "description": "Pipeline error tests now assert error.path on every path-not-found / permission-denied case (FIND-006 resolution). 7 error variants of statDir × FsError plus 5 settings.save FsError variants are exercised."
        },
        {
          "type": "file",
          "location": "promptnotes/src/lib/domain/__tests__/configure-vault/map-stat-dir-result.test.ts",
          "description": "Cross-product enumerate {Ok(true), Ok(false), Err(permission), Err(disk-full), Err(lock), Err(not-found), Err(unknown)} → {Ok(void), Err(path-not-found), Err(permission-denied)}."
        }
      ]
    },
    {
      "name": "implementation_correctness",
      "verdict": "PASS",
      "findings": [],
      "evidence": [
        {
          "type": "file",
          "location": "promptnotes/src/lib/domain/configure-vault/pipeline.ts",
          "description": "Step ordering invariants statDir → settingsSave → clockNow → emit verified by PROP-CV-008 ordering harness. No dead validateAndTransition call (FIND-002 resolution). clockNow at-most-once on success path; never on failure paths."
        },
        {
          "type": "test-output",
          "location": ".vcsdd/features/configure-vault/evidence/sprint-2-green-phase.log",
          "description": "Full bun suite 513/513 passing (320 baseline + 193 configure-vault) after in-place resolution of all 6 Phase-3 findings."
        }
      ]
    },
    {
      "name": "structural_integrity",
      "verdict": "PASS",
      "findings": [],
      "evidence": [
        {
          "type": "file",
          "location": ".vcsdd/features/configure-vault/verification/purity-audit.md",
          "description": "Purity boundary holds: pure helpers (validate-and-transition.ts, map-stat-dir-result.ts, map-settings-save-error.ts) have zero matches for Date.now/Math.random/process.*/new Date/globalThis. Effectful shell pipeline.ts touches deps record only."
        }
      ]
    },
    {
      "name": "verification_readiness",
      "verdict": "PASS",
      "findings": [],
      "evidence": [
        {
          "type": "file",
          "location": "promptnotes/src/lib/domain/__tests__/configure-vault/__verify__/",
          "description": "FIND-003 resolved: 4 fast-check property harnesses (port-call-budget, event-emission-discipline, no-unconfigured-from-pipeline, ordering) now consume their generators end-to-end; success-path varies userSelectedPath via fc.string(min:1) → vaultPath cast. PROP-CV-001..009 mapped to harness files; PROP-CV-007 Tier 0 type-level via tsc."
        },
        {
          "type": "proof-result",
          "location": ".vcsdd/features/configure-vault/verification/fuzz-results/property-tests.log",
          "description": "All property harnesses pass (50+ fast-check cases per harness, 200 numRuns each)."
        }
      ]
    }
  ],
  "convergenceSignals": {
    "findingCount": 0,
    "previousFindingCount": 6,
    "allCriteriaEvaluated": true,
    "evaluatedCriteria": [],
    "duplicateFindings": []
  }
}
