{
  "sprintNumber": 6,
  "feature": "ui-editor",
  "overallVerdict": "PASS",
  "timestamp": "2026-05-05T04:30:00Z",
  "iteration": 2,
  "reviewContext": {
    "reviewType": "implementation",
    "contractPath": "contracts/sprint-6.md",
    "contractDigest": "de6698375b6ad06483355d1d703ee0b0da00ee487e19cde05b1abd7125de909b"
  },
  "dimensions": [
    {
      "name": "spec_fidelity",
      "verdict": "PASS",
      "findings": [],
      "evidence": [
        {
          "type": "file",
          "location": "promptnotes/src-tauri/src/editor.rs",
          "description": "All 6 adversary findings resolved. copy_note_body has 2 params; eprintln! logging present"
        }
      ]
    },
    {
      "name": "edge_case_coverage",
      "verdict": "PASS",
      "findings": [],
      "evidence": [
        {
          "type": "file",
          "location": "promptnotes/src-tauri/src/editor.rs",
          "description": "TEMP_COUNTER atomic counter for collision avoidance"
        }
      ]
    },
    {
      "name": "implementation_correctness",
      "verdict": "PASS",
      "findings": [],
      "evidence": [
        {
          "type": "test-output",
          "location": "cargo test",
          "description": "cancel_switch emits empty string body; 23/23 cargo tests pass"
        }
      ]
    },
    {
      "name": "structural_integrity",
      "verdict": "PASS",
      "findings": [],
      "evidence": [
        {
          "type": "test-output",
          "location": "cargo clippy",
          "description": "Zero clippy warnings on editor.rs"
        }
      ]
    },
    {
      "name": "verification_readiness",
      "verdict": "PASS",
      "findings": [],
      "evidence": [
        {
          "type": "test-output",
          "location": "cargo test + vitest run",
          "description": "23/23 cargo + 195/195 vitest all pass"
        }
      ]
    }
  ],
  "convergenceSignals": {
    "findingCount": 0,
    "previousFindingCount": 6,
    "allCriteriaEvaluated": true,
    "evaluatedCriteria": [
      "CRIT-300",
      "CRIT-301",
      "CRIT-302",
      "CRIT-303",
      "CRIT-304",
      "CRIT-305"
    ]
  }
}