{
  "sprintNumber": 4,
  "feature": "ui-editor",
  "overallVerdict": "PASS",
  "timestamp": "2026-05-04T00:00:00Z",
  "iteration": 1,
  "reviewContext": { "reviewType": "contract", "contractPath": "contracts/sprint-4.md", "contractDigest": "d24e8a3a8298f25305c9094fb8828a19710a014672e1955d1af71ce97a417710" },
  "dimensions": [
    { "name": "spec_fidelity", "verdict": "PASS", "findings": [], "evidence": [{"type":"file","location":".vcsdd/features/ui-editor/contracts/sprint-4.md","description":"4 CRITs map 1:1 to FIND-014..017"}] },
    { "name": "edge_case_coverage", "verdict": "PASS", "findings": [], "evidence": [{"type":"file","location":".vcsdd/features/ui-editor/contracts/sprint-4.md","description":"FIND-016 included"}] },
    { "name": "implementation_correctness", "verdict": "PASS", "findings": [], "evidence": [{"type":"file","location":".vcsdd/features/ui-editor/contracts/sprint-4.md","description":"FIND-015 included"}] },
    { "name": "structural_integrity", "verdict": "PASS", "findings": [], "evidence": [{"type":"file","location":".vcsdd/features/ui-editor/contracts/sprint-4.md","description":"weights sum 1.00"}] },
    { "name": "verification_readiness", "verdict": "PASS", "findings": [], "evidence": [{"type":"file","location":".vcsdd/features/ui-editor/contracts/sprint-4.md","description":"FIND-017 reducer-only invariant restored"}] }
  ],
  "convergenceSignals": { "findingCount": 0, "allCriteriaEvaluated": true, "evaluatedCriteria": ["CRIT-001","CRIT-002","CRIT-003","CRIT-004"], "duplicateFindings": [] }
}
