{
  "sprintNumber": 5,
  "feature": "ui-editor",
  "overallVerdict": "FAIL",
  "timestamp": "2026-05-05T04:15:00Z",
  "iteration": 1,
  "reviewContext": {
    "reviewType": "implementation",
    "contractPath": "contracts/sprint-5.md",
    "contractDigest": "22812684739aced47533aa288fd9c7c45bd9f564ede65f70d02e4b188ca6c6cf"
  },
  "dimensions": [
    {
      "name": "spec_fidelity",
      "verdict": "FAIL",
      "findings": [
        "FIND-018",
        "FIND-023"
      ],
      "evidence": [
        {
          "type": "file",
          "location": "promptnotes/src-tauri/src/editor.rs:302-308",
          "description": "FIND-018: copy_note_body has issued_at parameter not in REQ-EDIT-034 spec (spec requires { noteId, body } only)"
        },
        {
          "type": "file",
          "location": "promptnotes/src-tauri/src/editor.rs:243-259",
          "description": "FIND-023: trigger_idle_save/trigger_blur_save discard source without logging"
        }
      ]
    },
    {
      "name": "edge_case_coverage",
      "verdict": "FAIL",
      "findings": [
        "FIND-022"
      ],
      "evidence": [
        {
          "type": "file",
          "location": "promptnotes/src-tauri/src/editor.rs:94-107",
          "description": "FIND-022: fs_write_file_atomic tempfile uses nanos-based suffix with no collision retry loop"
        },
        {
          "type": "file",
          "location": "promptnotes/src-tauri/tests/editor_handlers.rs:138-166",
          "description": "FIND-022: does_not_partial_write_on_error test name misleading"
        }
      ]
    },
    {
      "name": "implementation_correctness",
      "verdict": "FAIL",
      "findings": [
        "FIND-020"
      ],
      "evidence": [
        {
          "type": "file",
          "location": "promptnotes/src-tauri/src/editor.rs:293-294",
          "description": "FIND-020: cancel_switch emits hardcoded string 'current-note-body-not-provided' as body field"
        }
      ]
    },
    {
      "name": "structural_integrity",
      "verdict": "FAIL",
      "findings": [
        "FIND-019"
      ],
      "evidence": [
        {
          "type": "file",
          "location": "promptnotes/src-tauri/src/editor.rs:23",
          "description": "FIND-019: cargo clippy reports empty_line_after_doc_comments at editor.rs:23"
        },
        {
          "type": "file",
          "location": "promptnotes/src-tauri/src/editor.rs:86-91",
          "description": "FIND-019: doc comment says 'no unwrap()' but line 91 uses unwrap_or_else"
        },
        {
          "type": "file",
          "location": "promptnotes/src-tauri/src/editor.rs",
          "description": "verification: 0 occurrences of unsafe, .unwrap(), panic!, todo!, unimplemented!"
        }
      ]
    },
    {
      "name": "verification_readiness",
      "verdict": "FAIL",
      "findings": [
        "FIND-021"
      ],
      "evidence": [
        {
          "type": "test-output",
          "location": "cargo test --test editor_handlers",
          "description": "FIND-021: 18/18 integration tests pass but none validate TS adapter argument name compatibility with Rust commands"
        },
        {
          "type": "test-output",
          "location": "cargo test",
          "description": "23/23 cargo tests pass (18 editor + 5 feed); vitest 195/195 pass; cargo check exits 0"
        }
      ]
    }
  ]
}