{
  "sprintNumber": 1,
  "feature": "ui-tag-chip",
  "dimensions": [
    {
      "name": "spec_fidelity",
      "verdict": "PASS",
      "findings": [],
      "evidence": [
        {
          "type": "file",
          "location": "promptnotes/src/lib/feed/types.ts",
          "description": "FeedViewState extended with tagAutocompleteVisibleFor and activeFilterTags"
        },
        {
          "type": "file",
          "location": "promptnotes/src/lib/feed/FeedRow.svelte",
          "description": "Interactive tag chips with remove and add buttons, tag input with autocomplete"
        }
      ]
    },
    {
      "name": "implementation_correctness",
      "verdict": "PASS",
      "findings": [],
      "evidence": [
        {
          "type": "test-output",
          "location": "promptnotes/src/lib/feed/__tests__/feedReducer.tag.test.ts",
          "description": "72 unit tests pass covering all tag reducer actions"
        }
      ]
    },
    {
      "name": "structural_integrity",
      "verdict": "PASS",
      "findings": [],
      "evidence": [
        {
          "type": "file",
          "location": "promptnotes/src/lib/feed/FeedRow.svelte",
          "description": "DESIGN.md tokens: tag chip #f2f9ff/#097fe8, focus rings, aria labels"
        }
      ]
    },
    {
      "name": "verification_readiness",
      "verdict": "PASS",
      "findings": [],
      "evidence": [
        {
          "type": "file",
          "location": "promptnotes/src/lib/feed/tagInventory.ts",
          "description": "Pure tagInventoryFromMetadata, deterministic"
        },
        {
          "type": "file",
          "location": "promptnotes/src/lib/feed/feedReducer.ts",
          "description": "feedReducer remains pure, no forbidden APIs"
        }
      ]
    },
    {
      "name": "edge_case_coverage",
      "verdict": "PASS",
      "findings": [],
      "evidence": [
        {
          "type": "test-output",
          "location": "promptnotes/src/lib/feed/__tests__/feedReducer.tag.test.ts",
          "description": "Edge cases: empty/whitespace rejection, max length, mutual exclusion, note deletion"
        }
      ]
    }
  ],
  "overallVerdict": "PASS",
  "timestamp": "2026-05-05T10:15:00Z",
  "iteration": 1,
  "reviewContext": {
    "reviewType": "contract",
    "contractPath": "contracts/sprint-1.md",
    "contractDigest": "4f7f028d9cd37ab32933e1bb41ef0bf2d1667a733cbc6ed5933397b9a6b0ee08"
  }
}