{
  "sprintNumber": 1,
  "feature": "tag-chip-update",
  "dimensions": [
    {
      "name": "spec_fidelity",
      "verdict": "PASS",
      "findings": [],
      "evidence": [
        {
          "type": "proof-result",
          "location": "promptnotes/src/lib/domain/__tests__/tag-chip-update/pipeline.test.ts",
          "description": "REQ-TCU-001/002 happy-path add/remove: tagInventory.entries content asserted (PROP-TCU-008/009); PROP-TCU-013 source='curate-tag-chip' proved; Delta 6 3-arg outer curry matches behavioral-spec.md Revision 4"
        },
        {
          "type": "proof-result",
          "location": "promptnotes/src/lib/domain/__tests__/tag-chip-update/__verify__/prop-021-occurredon-coherence.harness.test.ts",
          "description": "REQ-TCU-010 occurredOn threading invariant: now===SaveNoteRequested.occurredOn===NoteFileSaved.occurredOn===TagInventoryUpdated.occurredOn by construction (PROP-TCU-021)"
        }
      ]
    },
    {
      "name": "edge_case_coverage",
      "verdict": "PASS",
      "findings": [],
      "evidence": [
        {
          "type": "proof-result",
          "location": "promptnotes/src/lib/domain/__tests__/tag-chip-update/__verify__/prop-002-add-tag-idempotent.harness.test.ts",
          "description": "PROP-TCU-002: idempotent add produces unchanged tags (200 runs, seed=42 and seed=99)"
        },
        {
          "type": "proof-result",
          "location": "promptnotes/src/lib/domain/__tests__/tag-chip-update/__verify__/prop-003-remove-tag-idempotent.harness.test.ts",
          "description": "PROP-TCU-003: idempotent remove produces unchanged tags (200 runs, seed=42 and seed=7)"
        },
        {
          "type": "proof-result",
          "location": "promptnotes/src/lib/domain/__tests__/tag-chip-update/pipeline.test.ts",
          "description": "PROP-TCU-004: REQ-TCU-003/004 no-op short-circuit — spy counters all 0 on idempotent paths (5+4 tests)"
        }
      ]
    },
    {
      "name": "implementation_correctness",
      "verdict": "PASS",
      "findings": [],
      "evidence": [
        {
          "type": "proof-result",
          "location": "promptnotes/src/lib/domain/__tests__/tag-chip-update/__verify__/prop-007-save-error-cause-exhaustive.harness.test.ts",
          "description": "PROP-TCU-007: SaveError + SaveValidationError.cause exhaustiveness — 13 tests, genuine @ts-expect-error non-vacuous; per-cause tests for note-not-in-feed, hydration-failed, frontmatter-invariant"
        },
        {
          "type": "proof-result",
          "location": "promptnotes/src/lib/domain/__tests__/tag-chip-update/__verify__/prop-012-note-edit-error-dead-variants.harness.test.ts",
          "description": "PROP-TCU-012: dead-variant @ts-expect-error directives for tag and duplicate-tag variants are non-vacuous; LiveAddTagError narrow type anchors the proof"
        },
        {
          "type": "proof-result",
          "location": "promptnotes/src/lib/domain/__tests__/tag-chip-update/pipeline.test.ts",
          "description": "PROP-TCU-006: save-failure path does not call updateProjectionsAfterSave, FeedOps.refreshSort, or publishInternal; PROP-TCU-018: FsError variant → NoteSaveFailureReason mapping correct for all 5 variants"
        }
      ]
    },
    {
      "name": "structural_integrity",
      "verdict": "PASS",
      "findings": [],
      "evidence": [
        {
          "type": "proof-result",
          "location": "promptnotes/src/lib/domain/__tests__/tag-chip-update/__verify__/prop-005-prev-frontmatter-non-null.harness.test.ts",
          "description": "PROP-TCU-005: previousFrontmatter sourced from loaded Note.frontmatter (200 runs); Tier-0 type assertion non-null; update-projections.ts:106-110 throws on null previousFrontmatter (runtime guard)"
        },
        {
          "type": "proof-result",
          "location": "promptnotes/src/lib/domain/__tests__/tag-chip-update/__verify__/prop-020-non-coupling.harness.test.ts",
          "description": "PROP-TCU-020: 'getEditorBuffer' extends keyof TagChipUpdateDeps is never; 'editingState' extends keyof TagChipUpdateDeps is never — structural non-coupling guarantee"
        },
        {
          "type": "proof-result",
          "location": "promptnotes/src/lib/domain/__tests__/tag-chip-update/step4-update-projections.test.ts",
          "description": "PROP-TCU-017: TagChipAddedOnFeed/TagChipRemovedOnFeed are CurateInternalEvent; not PublicDomainEvent; TagInventoryUpdated is CurateInternalEvent; NoteFileSaved/NoteSaveFailed are PublicDomainEvent"
        }
      ]
    },
    {
      "name": "verification_readiness",
      "verdict": "PASS",
      "findings": [],
      "evidence": [
        {
          "type": "test-output",
          "location": "promptnotes/src/lib/domain/__tests__/tag-chip-update/",
          "description": "127 pass, 0 fail (bun test, 2.05s); 40 verification harness tests pass; 21/21 PROP-TCU proved; 7/7 required (PROP-TCU-001..007) proved"
        },
        {
          "type": "proof-result",
          "location": "promptnotes/src/lib/domain/__tests__/tag-chip-update/__verify__/prop-015-clock-budget.harness.test.ts",
          "description": "PROP-TCU-015: clock budget spy harness — 8 path scenarios; idempotent/not-found/hydration-fail all 0 calls; write paths all exactly 1 call"
        },
        {
          "type": "proof-result",
          "location": "promptnotes/src/lib/domain/__tests__/tag-chip-update/__verify__/prop-001-apply-tag-operation-pure-purity.harness.test.ts",
          "description": "PROP-TCU-001: applyTagOperationPure referential transparency (200+100 runs, seed=42 and seed=7) — required obligation"
        }
      ]
    }
  ],
  "overallVerdict": "PASS",
  "timestamp": "2026-05-01T10:22:12.665Z",
  "iteration": 2,
  "reviewContext": {
    "reviewType": "implementation"
  },
  "convergenceSignals": {
    "findingCount": 0,
    "previousFindingCount": 6,
    "allCriteriaEvaluated": true,
    "duplicateFindings": [],
    "evaluatedCriteria": [
      "CRIT-001",
      "CRIT-002",
      "CRIT-003",
      "CRIT-004",
      "CRIT-005",
      "CRIT-006",
      "CRIT-007",
      "CRIT-008",
      "CRIT-009",
      "CRIT-010",
      "CRIT-011",
      "CRIT-012"
    ]
  }
}
