{
  "sprintNumber": 1,
  "feature": "ui-feed-list-actions",
  "overallVerdict": "PASS",
  "timestamp": "2026-05-04T18:00:00Z",
  "iteration": 3,
  "reviewContext": {
    "reviewType": "implementation",
    "contractPath": "contracts/sprint-1.md",
    "contractDigest": "896567526253f017e3fd52f94d4cc27cca6205272930b62297ce821b60640cb6"
  },
  "dimensions": [
    {
      "name": "spec_fidelity",
      "verdict": "PASS",
      "findings": [],
      "evidence": [
        {
          "type": "file",
          "location": "promptnotes/src/lib/feed/feedReducer.ts",
          "description": "All 18 REQ-FEED covered. FIND-I2-001 resolved. DomainSnapshotReceived full mirror."
        }
      ]
    },
    {
      "name": "edge_case_coverage",
      "verdict": "PASS",
      "findings": [],
      "evidence": [
        {
          "type": "test-output",
          "location": "promptnotes/src/lib/feed/__tests__/dom/",
          "description": "All 15 EC-FEED-001..015 covered. EC-FEED-010 documented as wire-unreachable (REQ-DLN-005)."
        }
      ]
    },
    {
      "name": "implementation_correctness",
      "verdict": "PASS",
      "findings": [],
      "evidence": [
        {
          "type": "test-output",
          "location": "promptnotes/src/lib/feed/__tests__/feedReducer.test.ts",
          "description": "feedReducer totality PROP-FEED-005 (300 runs), purity PROP-FEED-006 (200 runs)."
        }
      ]
    },
    {
      "name": "structural_integrity",
      "verdict": "PASS",
      "findings": [],
      "evidence": [
        {
          "type": "proof-result",
          "location": "promptnotes/src/lib/feed/feedRowPredicates.ts, feedReducer.ts, deleteConfirmPredicates.ts",
          "description": "PROP-FEED-031 purity-audit grep: zero hits. PROP-FEED-032 IPC boundary: zero hits."
        }
      ]
    },
    {
      "name": "verification_readiness",
      "verdict": "PASS",
      "findings": [],
      "evidence": [
        {
          "type": "proof-result",
          "location": "promptnotes/src/lib/feed/__tests__/refreshFeedEmission.test.ts",
          "description": "PROP-FEED-035 biconditional 500 runs. All 38 PROP-FEED obligations proved in Phase 5."
        }
      ]
    }
  ],
  "convergenceSignals": {
    "findingCount": 0,
    "previousFindingCount": 1,
    "allCriteriaEvaluated": true,
    "evaluatedCriteria": [
      "CRIT-001",
      "CRIT-002",
      "CRIT-003",
      "CRIT-004",
      "CRIT-005",
      "CRIT-006",
      "CRIT-007",
      "CRIT-008",
      "CRIT-009",
      "CRIT-010"
    ],
    "duplicateFindings": []
  }
}
