{
  "sprintNumber": 5,
  "feature": "ui-editor",
  "overallVerdict": "PASS",
  "timestamp": "2026-05-05T03:50:00.000Z",
  "iteration": 1,
  "reviewContext": {
    "reviewType": "contract",
    "contractPath": "contracts/sprint-5.md",
    "contractDigest": "22812684739aced47533aa288fd9c7c45bd9f564ede65f70d02e4b188ca6c6cf"
  },
  "dimensions": [
    {
      "name": "spec_fidelity",
      "verdict": "PASS",
      "findings": [],
      "evidence": [
        {
          "type": "file",
          "location": "promptnotes/src-tauri/src/lib.rs",
          "description": "All 8 editor:: commands registered in invoke_handler! macro (CRIT-200)"
        }
      ]
    },
    {
      "name": "edge_case_coverage",
      "verdict": "PASS",
      "findings": [],
      "evidence": [
        {
          "type": "file",
          "location": "promptnotes/src-tauri/tests/editor_handlers.rs",
          "description": "18 integration tests cover atomic write, DTO serialization, event payload correctness (CRIT-201/202)"
        }
      ]
    },
    {
      "name": "implementation_correctness",
      "verdict": "PASS",
      "findings": [],
      "evidence": [
        {
          "type": "file",
          "location": "promptnotes/src-tauri/src/editor.rs",
          "description": "fs_write_file_atomic tempfile+rename pattern; editing_session_state_changed event payload matches TS EditingSessionState type (CRIT-203)"
        }
      ]
    },
    {
      "name": "structural_integrity",
      "verdict": "PASS",
      "findings": [],
      "evidence": [
        {
          "type": "file",
          "location": "promptnotes/src-tauri/src/editor.rs",
          "description": "Zero unsafe blocks, zero unwrap/panic/todo; serde rename_all=camelCase on all DTOs; 195 vitest tests regression-free (CRIT-204)"
        }
      ]
    },
    {
      "name": "verification_readiness",
      "verdict": "PASS",
      "findings": [],
      "evidence": [
        {
          "type": "file",
          "location": "promptnotes/src-tauri/tests/editor_handlers.rs",
          "description": "23/23 cargo tests pass (18 editor + 5 feed); cargo check exits 0 (CRIT-205)"
        }
      ]
    }
  ]
}
