{
  "sprintNumber": 3,
  "feature": "ui-editor",
  "overallVerdict": "FAIL",
  "timestamp": "2026-05-04T00:00:00Z",
  "iteration": 2,
  "reviewContext": {
    "reviewType": "implementation",
    "contractPath": "contracts/sprint-3.md",
    "contractDigest": "26d73528c7dd127ec0eea41e6011cde1039dc0273ca13d2f451199c28f7ea175"
  },
  "dimensions": [
    {
      "name": "spec_fidelity",
      "verdict": "FAIL",
      "findings": [
        "FIND-014"
      ],
      "evidence": [
        {
          "type": "file",
          "location": ".vcsdd/features/ui-editor/reviews/phase-3/iteration-2/output/findings/FIND-014.md",
          "description": "REQ-EDIT-025 deferred dispatch"
        }
      ]
    },
    {
      "name": "edge_case_coverage",
      "verdict": "FAIL",
      "findings": [
        "FIND-016"
      ],
      "evidence": [
        {
          "type": "file",
          "location": ".vcsdd/features/ui-editor/reviews/phase-3/iteration-2/output/findings/FIND-016.md",
          "description": "idle save in save-failed"
        }
      ]
    },
    {
      "name": "implementation_correctness",
      "verdict": "FAIL",
      "findings": [
        "FIND-015"
      ],
      "evidence": [
        {
          "type": "file",
          "location": ".vcsdd/features/ui-editor/reviews/phase-3/iteration-2/output/findings/FIND-015.md",
          "description": "retry issuedAt empty"
        }
      ]
    },
    {
      "name": "structural_integrity",
      "verdict": "PASS",
      "findings": [],
      "evidence": [
        {
          "type": "file",
          "location": ".vcsdd/features/ui-editor/specs/behavioral-spec.md",
          "description": "banner styling, ARIA all green"
        }
      ]
    },
    {
      "name": "verification_readiness",
      "verdict": "FAIL",
      "findings": [
        "FIND-017"
      ],
      "evidence": [
        {
          "type": "file",
          "location": ".vcsdd/features/ui-editor/reviews/phase-3/iteration-2/output/findings/FIND-017.md",
          "description": "inbound bridge bypasses reducer"
        }
      ]
    }
  ],
  "convergenceSignals": {
    "findingCount": 4,
    "allCriteriaEvaluated": true,
    "evaluatedCriteria": [
      "CRIT-001",
      "CRIT-002",
      "CRIT-003",
      "CRIT-004",
      "CRIT-005",
      "CRIT-006",
      "CRIT-007",
      "CRIT-008",
      "CRIT-009",
      "CRIT-010",
      "CRIT-011",
      "CRIT-012",
      "CRIT-013",
      "CRIT-014"
    ],
    "duplicateFindings": []
  }
}
