{
  "sprintNumber": 1,
  "feature": "ui-editor",
  "overallVerdict": "PASS",
  "timestamp": "2026-05-04T00:00:00Z",
  "iteration": 1,
  "reviewContext": {
    "reviewType": "implementation",
    "contractPath": "contracts/sprint-1.md",
    "contractDigest": "b0e041fdf5ec75f9341ac0b6888d4850edb57b8efd9578cfc70c1f7ed659eb23"
  },
  "dimensions": [
    { "name": "spec_fidelity", "verdict": "PASS", "findings": [], "evidence": [{"type":"file","location":"promptnotes/src/lib/editor/editorReducer.ts","description":"Sprint 1 pure-core reducer is total over 11x5; PROP-EDIT-001..010 + 040 all green per sprint-1-green-phase.log"}] },
    { "name": "edge_case_coverage", "verdict": "PASS", "findings": [], "evidence": [{"type":"file","location":"promptnotes/src/lib/editor/__tests__/editorReducer.test.ts","description":"126/126 unit + property tests pass; EC-EDIT-001/002/006 covered at the schedule + reducer level"}] },
    { "name": "implementation_correctness", "verdict": "PASS", "findings": [], "evidence": [{"type":"file","location":"promptnotes/src/lib/editor/debounceSchedule.ts","description":"computeNextFireAt + shouldFireIdleSave conform to RD-019; 100% pure"}] },
    { "name": "structural_integrity", "verdict": "PASS", "findings": [], "evidence": [{"type":"file","location":"promptnotes/src/lib/editor/types.ts","description":"_AssertEditNoteBodyShape + _AssertCopyNoteBodyShape compile-time assertions present; canonical purity grep returns zero hits in pure files"}] },
    { "name": "verification_readiness", "verdict": "PASS", "findings": [], "evidence": [{"type":"file","location":".vcsdd/features/ui-editor/evidence/sprint-1-green-phase.log","description":"target feature tests: pass; regression baseline: pass"}] }
  ],
  "convergenceSignals": {
    "findingCount": 0,
    "allCriteriaEvaluated": true,
    "evaluatedCriteria": ["CRIT-001","CRIT-002","CRIT-003","CRIT-004","CRIT-005","CRIT-006","CRIT-007","CRIT-008","CRIT-009","CRIT-010","CRIT-011","CRIT-012"],
    "duplicateFindings": []
  }
}
