{
  "sprintNumber": 1,
  "feature": "ui-tag-chip",
  "dimensions": [
    { "name": "spec_fidelity", "verdict": "PASS", "findings": [], "evidence": [{ "type": "file", "location": "src/lib/feed/feedReducer.ts" }] },
    { "name": "implementation_correctness", "verdict": "PASS", "findings": [], "evidence": [{ "type": "test-output", "location": "src/lib/feed/__tests__/" }] },
    { "name": "structural_integrity", "verdict": "PASS", "findings": [], "evidence": [{ "type": "file", "location": "src/lib/feed/FeedRow.svelte" }] },
    { "name": "verification_readiness", "verdict": "PASS", "findings": [], "evidence": [{ "type": "file", "location": "verification/verification-report.md" }] },
    { "name": "edge_case_coverage", "verdict": "PASS", "findings": [], "evidence": [{ "type": "test-output", "location": "src/lib/feed/__tests__/feedReducer.tag.test.ts" }] }
  ],
  "overallVerdict": "PASS",
  "timestamp": "2026-05-05T11:00:00Z",
  "iteration": 1,
  "convergenceSignals": {
    "findingCount": 0,
    "previousFindingCount": 14,
    "allCriteriaEvaluated": true,
    "evaluatedCriteria": ["CRIT-001", "CRIT-002", "CRIT-003", "CRIT-004", "CRIT-005", "CRIT-006", "CRIT-007"]
  }
}
